,headlines,content,fakeness
1373,Underworld Connections: Mumbai Politician's Links to Organized Crime Syndicate Revealed. Corruption Scandal Hits Close to Home.,"Investigations uncover a web of illicit deals and backroom alliances. [February 7, 2024]",1
1374,Breaking: Ancient Temple Uncovered Beneath New Delhi. Archaeologists Stunned by Discovery of Forgotten Religious Site.,"Historians and religious leaders speculate on the significance of the hidden temple. [February 7, 2024]",1
1375,Unprecedented Chaos: Delhi Metro Hit by Time-Space Anomaly. Passengers Report Being Transported to Different Eras.,"Commuters left bewildered as the metro system experiences bizarre disruptions. [February 7, 2024]",1
1376,"Exclusive: Top CEO Arrested for Corporate Espionage, Rival Companies Implicated. Industrial Espionage Scandal Rocks Business Sector.","Corporate world shaken as details of espionage and sabotage come to light. [February 9, 2024]",1
1377,Mass Hysteria: Delhi Residents Report Ghostly Apparitions in Neighborhoods. Paranormal Experts Investigate Haunting Phenomena.,"Fear grips the capital as eerie sightings and strange occurrences multiply. [February 9, 2024]",1
1378,Crisis Averted: Mumbai Police Foil Assassination Attempt on High-profile Politician. Suspects Believed to Have Foreign Connections.,"Security heightened as authorities thwart an international conspiracy. [February 8, 2024]",1
1379,Exclusive: Top Bollywood Star's Double Life Exposed. Shocking Details of Hidden Identity and Secret Activities Revealed.,"Fans left stunned as the beloved actor's private life is laid bare. [February 8, 2024]",1
1380,"Breaking: Massive Sinkhole Appears in Central Delhi, Swallows Several Vehicles. Residents Flee in Panic as Ground Crumbles.","Emergency crews rush to the scene as the city grapples with the sudden geological event. [February 8, 2024]",1
1381,Danger Lurks: New Delhi Park Closed After Reports of Giant Man-Eating Plants. Authorities Warn Public to Stay Away.,"Fear spreads as rumors of carnivorous vegetation terrorizing park-goers circulate. [February 8, 2024]",1
1382,Cultural Controversy: Ancient Artifact Theft Rocks Kolkata Museum. Priceless Relic Stolen Under Mysterious Circumstances.,"Authorities baffled as the museum's security measures fail to prevent the brazen theft. [February 7, 2024]",1
1383,Exclusive: Top Politician's Secret Underwater Lair Discovered off Mumbai Coast. Lavish Hideout Raises Questions of Illicit Activities.,"Divers stumble upon the opulent underwater hideaway, sparking investigations. [February 7, 2024]",1
1384,Terror Strikes: Delhi Mall Hit by Unexplained Series of Explosions. Speculation Rife About Sinister Plot Behind Attacks.,"Investigators scramble to determine the cause of the mysterious mall explosions. [February 7, 2024]",1
1385,Breaking: New Delhi's Elite Private School Accused of Hosting Dark Magic Rituals. Parents Demand Investigation into Occult Practices.,"Outrage mounts as allegations of witchcraft and rituals surface in prestigious school. [February 7, 2024]",1
1386,Exclusive: Top Scientist's Disappearance Linked to Government Conspiracy. Whistleblower's Vanishing Act Shrouded in Mystery.,"Conspiracy theories abound as the renowned scientist goes missing under suspicious circumstances. [February 9, 2024]",1
1387,Crisis in Capital: New Delhi Hit by Massive Power Outage. Residents Left in Darkness as Electricity Grid Fails.,"Chaos ensues as the city grapples with the widespread blackout. [February 9, 2024]",1
1388,Scandal Unveiled: Political Leaders Caught in Corruption Sting. Undercover Investigation Exposes Bribery and Kickback Scheme.,"Calls for resignations grow as damning evidence of corruption emerges. [February 8, 2024]",1
1389,"Breaking: New Delhi Zoo Animals Escape, Residents Warned to Stay Indoors. Chaos Erupts as Tigers, Elephants Roam Streets.","Authorities issue urgent alerts as the city turns into a wild animal sanctuary. [February 8, 2024]",1
1390,"""Alien Invasion in Mumbai! Witnesses Claim Spaceship Sighted Over Gateway of India""","Eyewitnesses report seeing a massive spaceship hovering over the iconic Mumbai landmark, sparking fears and excitement among residents. [February 11, 2024]",1
1391,"""Breaking: Loch Ness Monster Spotted in Kerala Backwaters, Tourists Flock to Witness""","A mysterious creature resembling the legendary Loch Ness Monster has allegedly been sighted in the serene backwaters of Kerala, drawing curious onlookers and cryptozoologists. [February 11, 2024]",1
1392,"""Exclusive: PM Modi's Secret Dance Video Goes Viral, Fans Demand 'Nach Baliye' Appearance""","A leaked video purportedly showing Prime Minister Modi showcasing his dance moves in a private gathering has taken social media by storm, with calls for his participation in the popular dance reality show. [February 11, 2024]",1
1393,"""Giant Purple Unicorns Spotted Grazing in Himachal Pradesh Forests, Scientists Baffled""","Local villagers in Himachal Pradesh claim to have witnessed a herd of gigantic purple unicorns grazing peacefully in the dense forests, leaving scientists scratching their heads. [February 11, 2024]",1
1394,"""World's First Talking Elephant Discovered in Assam, Scientists Rush for Studies""","Researchers in Assam are astounded by the discovery of an elephant that reportedly speaks fluent Assamese, opening new doors for interspecies communication studies. [February 11, 2024]",1
1395,"""Breaking: Bollywood Star Marries Extraterrestrial Partner on Mars, Wedding Televised Globally""","In a groundbreaking ceremony, a popular Bollywood actor ties the knot with their extraterrestrial partner on Mars, capturing the attention of Earth and beyond. [February 11, 2024]",1
1396,"""Rahul Gandhi Reveals Secret Life as Himalayan Yogi, Changes Name to 'Om Prakash Gandhi'""","In a shocking revelation, Rahul Gandhi discloses his hidden identity as a Himalayan yogi, renames himself 'Om Prakash Gandhi', and plans to embark on a spiritual journey. [February 11, 2024]",1
1397,"""Indian Ocean Mermaid Captured Alive off Goa Coast, Scientists Thrilled""","Fishermen off the coast of Goa claim to have caught a live mermaid from the Indian Ocean, sparking excitement and scientific inquiries into this mythical creature. [February 11, 2024]",1
1398,"""Government Unveils Plan for Underwater City off Mumbai Coast, Dubbed 'Atlantis of India'""","Authorities announce ambitious plans to build an underwater city off the Mumbai coast, complete with submerged skyscrapers and marine life habitats. [February 11, 2024]",1
1399,"""Amitabh Bachchan to Contest Next Lok Sabha Elections from Mars, Says 'Time for Interplanetary Politics'""","Bollywood megastar Amitabh Bachchan shocks the nation by announcing his candidacy for the next Lok Sabha elections, with plans to represent Mars and promote interplanetary diplomacy. [February 11, 2024]",1
1400,"""Breaking: Cows Found Flying Over Delhi, Residents Marvel at Bovine Aeronautics""","Delhi witnesses a surreal sight as cows are spotted gracefully flying over the city skyline, prompting awe, laughter, and a flurry of social media posts. [February 11, 2024]",1
1401,"""Supreme Court Rules Animals Have Voting Rights, Paves Way for 'Paw-litical' Participation""","In a landmark decision, the Supreme Court grants voting rights to animals, leading to speculation on how this will impact future elections and political landscapes. [February 11, 2024]",1
1402,"""Einstein's Reincarnation Found in Kolkata Toddler, Solving Mathematical Mysteries at Age 2""","A child prodigy in Kolkata astounds experts by solving complex mathematical problems, with claims that he is the reincarnation of Albert Einstein. [February 11, 2024]",1
1403,"""Delhi Metro to Introduce Time Travel Trains, Commuters Can Now Journey to Future""","Delhi Metro announces the launch of 'Time Travel Trains', allowing commuters to experience journeys into the future, revolutionizing the concept of daily travel. [February 11, 2024]",1
1404,"""Breaking: Taj Mahal Revealed to be Ancient Alien Landing Pad, Archaeologists Stunned""","Startling revelations suggest that the iconic Taj Mahal was actually an ancient alien landing pad, rewriting history books and captivating conspiracy theorists worldwide. [February 11, 2024]",1
1405,"""New Delhi Declared World's First 'Unicorn City', Not for Startups but Actual Unicorns""","In an unexpected turn, New Delhi earns the title of the world's first 'Unicorn City', but not for tech startups - for being home to real-life unicorns roaming its streets. [February 11, 2024]",1
1406,"""Breaking: Mount Everest Turns into Volcano, Lava Flow Threatens Himalayan Region""","Mount Everest undergoes a dramatic transformation, erupting into a volcano and spewing lava, posing a threat to the surrounding Himalayan communities. [February 11, 2024]",1
1407,"""Indian Army Unveils Invisible Tanks, Makes 'Ghost Recon' a Reality""","In a leap of military technology, the Indian Army introduces invisible tanks, rendering them undetectable to the naked eye and reshaping modern warfare. [February 11, 2024]",1
1408,"""Breaking: Gandalf the Grey Spotted Leading Protest March in Gandhinagar""","A wizardly figure resembling Gandalf the Grey from 'Lord of the Rings' is seen leading a protest march in Gandhinagar, advocating for magical rights and policies. [February 11, 2024]",1
1409,"""Giant Squirrels Discovered in Shimla Forests, Prompt Calls for 'Squirrel Watch'""","Enormous squirrels, the size of small bears, are reportedly found in the forests of Shimla, sparking a frenzy of 'Squirrel Watch' initiatives and sightings. [February 11, 2024]",1
1410,"""Breaking: Kolkata Fish Market Sells Flying Fish, Customers Enjoy Airborne Delicacy""","The famous fish markets of Kolkata offer a new delicacy - flying fish, which customers claim is a delightful culinary experience as they float off plates. [February 11, 2024]",1
1411,"""Archaeologists Discover Time Capsule in Agra, Contents Reveal Mughal Emperor's Secret Recipes""","A hidden time capsule unearthed in Agra contains not historical documents, but Mughal Emperor's secret recipes for legendary dishes, exciting food enthusiasts. [February 11, 2024]",1
1412,"""Delhi Traffic Lights Begin Communicating in Morse Code, Confuse and Amuse Drivers""","Traffic lights across Delhi start transmitting messages in Morse code, leaving drivers both baffled and entertained as they decode signals for 'Stop', 'Go', and 'Wait'. [February 11, 2024]",1
1413,"""Breaking: Bollywood Film Crew Abducts Alien for Extraterrestrial Romance Movie""","A Bollywood film crew reportedly abducts an actual alien for their latestromance movie, sparking controversy, debates on interspecies love, and a galactic box office hit. [February 11, 2024]",1
1414,"""Guru Nanak's Reincarnation Found in Punjab Farmer, Preaches Farming as Religion""","A humble farmer in Punjab is hailed as the reincarnation of Guru Nanak, advocating for farming as a sacred duty and igniting a spiritual revolution in agriculture. [February 11, 2024]",1
1415,"Breaking: Shocking Corruption Uncovered in Opposition Leader's Past, Ties to Underground Syndicate Revealed. ED's Investigation Exposes Harak Rawat's Dark History.","Rawat allegedly involved in clandestine dealings during tenure as forest minister, raising questions on his ethical standards. [February 7, 2024]",1
1416,Ram Temple Resolution Controversy: SP MLAs Accused of Secretly Opposing PM Modi and CM Yogi. Internal Dissent Grows as Party Faces Backlash.,"Resolution thanked leaders for temple ceremony, but whispers suggest some SP members privately criticized the move. [February 7, 2024]",1
1417,Southern Alliance Protests in Delhi: Karnataka and Kerala Governments Accused of Orchestrating Disruptive Protests in the Capital.,"Allegations surface of a calculated move to destabilize the Centre's governance, stirring unrest for political gain. [February 7, 2024]",1
1418,"BJP's UCC Agenda: Hidden Motives Revealed, Critics Claim Move is a Diversionary Tactic. Opposition Accuses BJP of Strategic Political Maneuvering.","Opposition voices raise suspicions, pointing out BJP's timing with upcoming elections and coalition concerns. [February 7, 2024]",1
1419,"Sharad Pawar's Party Renaming: EC's Deadline Raises Eyebrows, Opposition Claims Foul Play. Pawar Group Under Scrutiny Amid Electoral Chaos.","Speculations arise about possible interference as Pawar's camp rushes to comply with EC's request. [February 7, 2024]",1
1420,Chandrababu Naidu's Mysterious Delhi Visit: Is BJP Cozying Up to TDP? Cryptic Messages Hint at Secret Talks.,"Political circles abuzz with rumors of potential alliances as Naidu's visit raises eyebrows. [February 7, 2024]",1
1421,South Alliance Eruption: Priyank Kharge's Veiled Threats Spark Fear of Southern States' Rebellion. Centre Braces for Potential Showdown.,"Kharge's remarks hint at simmering discontent, prompting fears of a unified front against the government. [February 7, 2024]",1
1422,Shinde Sena's Caste Census U-turn: OBC Backlash Forces Shiv Sena MP's Sudden Support for Caste-based Census. Political Pandering Exposed.,"MP's endorsement comes amidst growing OBC dissatisfaction, raising questions about Sena's true intentions. [February 7, 2024]",1
1423,BJP's Farm Yatra Controversy: Nadda Accused of Hijacking Farmers' Movement for Political Gains. Opposition Lambasts BJP's 'Sham' Outreach.,"Nadda's yatra draws criticism as opposition claims BJP is exploiting farmers' issues for electoral purposes. [February 6, 2024]",1
1424,"Centre's Financial Atrocities: Karnataka and Kerala Bring Dubious Claims to Delhi, Opposition Questions Motives.","Opposition cries foul as states take grievances to Delhi, accusing Centre of biased financial policies. [February 7, 2024]",1
1425,Thalapathy Vijay's Political Debut Raises Eyebrows: Critics Slam Actor's Lack of Political Experience. Tamil Nadu's Political Scene in Disarray.,"Vijay's entry into politics met with skepticism, as critics question his preparedness for the political arena. [February 7, 2024]",1
1426,Priyanka Gandhi's Nehru Speech Controversy: Modi's Alleged Misrepresentation Sparks Outrage. Congress Demands Clarification.,"Congress accuses PM Modi of distorting Nehru's words, igniting a fresh war of words. [February 7, 2024]",1
1427,Election Chaos: Parties Accused of Exploiting Exam Paper Leaks for Political Gain. Public Outcry Mounts as Integrity of Polls Questioned.,"Recent elections marred by allegations of paper leaks, casting doubt on electoral process. [February 6, 2024]",1
1428,Odisha's Ambedkar ISBT Unveiling: BJD's Dalit Outreach Strategy Unveiled. Opposition Cries Foul over Timing.,"BJD's move to name bus terminal after Ambedkar met with skepticism, with critics calling it an election stunt. [February 6, 2024]",1
1429,"Uttarakhand's UCC Bill Backlash: AIMPLB Slams Government, Calls Bill Discriminatory. Outrage Grows Over Alleged Anti-Muslim Bias.","AIMPLB condemns state government's UCC Bill, accusing it of targeting Muslim identity. [February 7, 2024]",1
1430,JD(U)'s Political Vendetta Claims: ED's Tightening Grip on Bihar MLC Sparks Controversy. Party Cries Foul Play.,"JD(U) cries foul as ED intensifies probe into MLC's assets, accusing agency of political witch-hunt. [February 6, 2024]",1
1431,"Urdu Press Allegations: AAP Leaders Accuse ED of 'Witch-Hunt', Demand Fair Investigation. Political Drama Unfolds.","AAP leaders cry foul over ED's actions, accusing agency of bias and political manipulation. [February 6, 2024]",1
1432,"Akhilesh Yadav's PDA Game Plan Exposed: BJP Accuses SP of Caste Politics, Calls Move Desperate. Political Rivalry Escalates.","SP's PDA strategy under scrutiny as BJP labels it a ploy for caste-based politics. [February 6, 2024]",1
1433,"Modi's Hat-Trick Ambitions: Opposition Calls PM's Claims 'Empty Promises', BJP's Alleged Free Fall Exposed.","Opposition dismisses PM's achievements as hollow, pointing to alleged failures. [February 6, 2024]",1
1434,Congress' Binary Trap Dilemma: PM Modi's Aggressive Stance Puts Congress on Defensive. Political Chess Game Intensifies.,"Congress strategizes as PM Modi's attacks force party into a defensive position. [February 6, 2024]",1
1435,"Outrage Over BJP's UCC Bill: Critics Accuse Party of Discrimination, Sparking Nationwide Protests. Opposition Demands Repeal.","BJP's UCC Bill faces backlash as critics call it discriminatory, fueling protests across the country. [February 6, 2024]",1
1436,"BJP's Farm Yatra Controversy: Opposition Labels Event a 'Political Circus', Accuses BJP of Exploiting Farmers.","BJP's farm yatra draws criticism as opposition claims it's a mere spectacle to garner votes. [February 6, 2024]",1
1437,"UCC Bill Turmoil in Uttarakhand Assembly: Opposition Walks Out in Protest, Calls Bill 'Divisive'. Chaos Ensues in Assembly.","Uttarakhand Assembly in disarray as opposition slams UCC Bill, walks out in protest. [February 6, 2024]",1
1438,"Karnataka and Kerala's Delhi Protests: Centre Accuses States of Disrupting Governance, Labels Protests 'Politically Motivated'.","Centre criticizes states for protests, alleging they are politically motivated to disrupt governance. [February 7, 2024]",1
1439,"Controversy Over Caste Census Demand: Shiv Sena Faces Backlash, Accused of Pandering to Vote Banks.","Shiv Sena's sudden support for caste census draws criticism, with accusations of playing politics. [February 7, 2024]",1
1440,Shocking Revelation: PM Modi's Secret Affair with Opposition Leader Unveiled!,"PM Modi caught in a scandalous affair with surprising political rival, sending shockwaves through the nation. [February 6, 2024]",1
1441,Exclusive: Congress Leader's Hidden Fortune Uncovered in Offshore Accounts!,"Congress leader's offshore accounts reveal staggering wealth, raising questions of corruption. [February 6, 2024]",1
1442,Explosive Video Leaks: BJP MPs Caught in Bribery Scandal!,"Undercover footage exposes BJP MPs accepting bribes, sparking major political uproar. [February 6, 2024]",1
1443,Sensational Twist: NDA Government's Links to Organized Crime Exposed!,"Allegations surface linking NDA officials to organized crime syndicates, shaking the foundation of the ruling party. [February 6, 2024]",1
1444,Breaking: High-Profile Congress Members Implicated in Tax Evasion Scheme!,"Top Congress leaders under investigation for massive tax evasion scheme, facing imminent legal action. [February 6, 2024]",1
1445,Scandal Alert: BJP's Secret Plan to Divide India Revealed by Whistleblower!,"Whistleblower exposes BJP's covert strategy to sow division among states, causing public outrage. [February 6, 2024]",1
1446,Corruption at its Peak: Shocking Details of NDA's Black Money Network Exposed!,"Investigative report unveils extensive network of black money within NDA ranks, calling integrity into question. [February 6, 2024]",1
1447,Uncovered: Congress's Underground Network of Spies Within BJP!,"Congress's covert operation within BJP unmasked, revealing espionage tactics and internal sabotage. [February 6, 2024]",1
1448,Explosive Interview: Former NDA Minister's Tell-All on Government's Dirty Secrets!,"Ex-minister exposes NDA's hidden scandals and unethical practices, implicating top officials. [February 6, 2024]",1
1449,Breaking Scandal: BJP Chief's Illicit Affair with Celebrity Revealed in Leaked Messages!,"Leaked messages expose BJP chief's affair with popular celebrity, causing major embarrassment for the party. [February 6, 2024]",1
1450,Congress's Secret Alliance with Foreign Powers Exposed in Leaked Documents!,"Confidential documents reveal Congress's clandestine deals with foreign entities, raising national security concerns. [February 6, 2024]",1
1451,NDA's Backdoor Deals Exposed: BJP Ministers Caught in Audio Scandal!,"Audio recordings reveal BJP ministers discussing illegal deals and kickbacks, triggering public outrage. [February 6, 2024]",1
1452,Shocking Revelations: Congress Leaders' Lavish Lifestyles Funded by Taxpayer Money!,"Investigation uncovers how top Congress members are living extravagant lives on taxpayers' dime. [February 6, 2024]",1
1453,Explosive Expose: NDA's Secret Plan to Privatize Public Services Unveiled!,"Leaked documents expose NDA's hidden agenda to privatize crucial public services, sparking widespread condemnation. [February 6, 2024]",1
1454,Congress's Double Standards Exposed: Leaders Caught in Hypocrisy Scandal!,"Congress leaders exposed for preaching morality while engaging in hypocritical behavior, shocking the public. [February 6, 2024]",1
1455,"Breaking: BJP's Fake News Factory Exposed, Misleading Nation for Years!","Investigation reveals BJP's extensive network spreading fake news and propaganda, manipulating public opinion. [February 6, 2024]",1
1456,Congress's Top Secret: High-Level Meeting to Sabotage BJP's Election Campaign!,"Leaked documents expose Congress's covert plans to undermine BJP's electoral efforts, causing uproar. [February 6, 2024]",1
1457,NDA's Dirty Politics: BJP Caught Red-Handed in Vote Rigging Scandal!,"Evidence surfaces of BJP's involvement in rigging elections, casting doubt on the democratic process. [February 6, 2024]",1
1458,Explosive Scandal: Congress Leader's Shocking Confession of Embezzlement!,"Senior Congress member confesses to embezzling funds, admitting to years of financial misconduct. [February 6, 2024]",1
1459,BJP's Bribery Bonanza: Shocking Footage of Ministers Taking Cash Bribes!,"Undercover video captures BJP ministers accepting stacks of cash in exchange for favors, sparking outrage. [February 6, 2024]",1
1460,Congress's Betrayal: Secret Pact with Opposition to Topple NDA Government!,"Leaked documents reveal Congress's clandestine agreement with opposition parties to bring down NDA government. [February 6, 2024]",1
1461,NDA's Crony Capitalism Exposed: BJP Leaders' Close Ties to Corporate Giants!,"Investigation uncovers BJP's cozy relationship with corporate giants, raising questions of favoritism. [February 6, 2024]",1
1462,Congress's Fake Promises: Leaders Caught on Tape Admitting to Deception!,"Audio recordings surface of Congress leaders admitting to making false promises for political gain. [February 6, 2024]",1
1463,BJP's Dark Secret: Scandalous Revelations of Party's Misuse of Power!,"Whistleblower exposes BJP's abuse of power for personal gain, shocking the nation. [February 6, 2024]",1
1464,Congress's Shadowy Deals: Leaders Caught in Backroom Negotiations for Kickbacks!,"Exposed: Congress leaders negotiating illicit deals for personal kickbacks, betraying public trust. [February 6, 2024]",1
1465,"Shocking Revelation: TMC Leader Caught in Money Laundering Scandal, Party Scrambles for Damage Control.","Anonymous sources reveal Dev Adhikari's alleged involvement in a multi-million dollar money laundering scheme.[February 5, 2024]",1
1466,"Alliance Unraveling: RLD Leaders Accuse Party Chief Jayant Chaudhary of Backroom Deals, Demand Transparency.","Internal strife erupts as RLD members protest seat allocations, citing favoritism and lack of clarity.[February 5, 2024]",1
1467,"Imam's Controversial Move: Umer Ahmed Ilyasi Faces Criticism for Attending Ram Mandir Event, Community Outraged.","Imam's decision to attend Ram Temple inauguration sparks outrage among Muslim groups, questioning his motives.[February 5, 2024]",1
1468,"Mamata's Calculated Move: TMC Chief's Alleged Divide-and-Conquer Strategy Exposed, Congress Calls for Unity.","Mamata's divisive rhetoric at rally raises concerns of polarization among voters, opposition parties unite against TMC's tactics.[February 5, 2024]",1
1469,"Political Grandstanding: Modi's Multi-Crore Assam Projects Amidst Rising Criticism, Opposition Labels Move 'Election Gimmick'.","As PM rolls out projects, opposition parties accuse BJP of using public funds for pre-election PR.[February 4, 2024]",1
1470,"Government Shake-Up: MP Minister Mohan Yadav Faces Backlash Over Controversial IAS Transfers, Opposition Demands Inquiry.","Yadav's reshuffling of IAS officers sparks controversy, with allegations of favoritism and political interference.[February 4, 2024]",1
1471,"Controversy Over Bharat Ratna: Advani's Award Criticized as BJP's 'Desperate Bid for Votes', Opposition Slams Move.","Opposition parties question timing of Advani's Bharat Ratna, accuse BJP of using it for political gain ahead of polls.[February 4, 2024]",1
1472,"Modi's Selective Targeting: PM's Silence on Naveen Patnaik Raises Eyebrows, Critics Call it 'Political Compromise'.","Modi's omission of criticism towards Patnaik's government leads to speculation of secret alliances, opposition demands clarity.[February 4, 2024]",1
1473,"BJP's Internal Turmoil: Ganpat Gaikwad Scandal Exposes Cracks in Party Leadership, Allies Express Displeasure.","BJP MLA's conflict with ally reveals internal power struggles, threatens to fracture coalition in key region.[February 29, 2024]",1
1474,"Congress's Regional Rivalry: D K Suresh's Separatist Remark Sparks Outrage, BJP Accuses Party of Divisive Politics.","Congress leader's controversial statement on separate statehood stirs debate, BJP condemns Congress for 'anti-national' rhetoric.[February 4, 2024]",1
1475,"Advani's Legacy Questioned: Critics Point to Controversies and Failures in BJP Icon's Career, BJP Scrambles to Defend.","As Advani receives Bharat Ratna, opposition highlights his past controversies and failures, BJP faces tough questions.[February 4, 2024]",1
1476,Modi's Award Politics: Opposition Slams PM for 'Selective Honoring' as Bharat Ratna List Draws Criticism.,"Modi's government under fire for allegedly politicizing Bharat Ratna, opposition demands fair and transparent process.[February 4, 2024]",1
1477,"Congress's Electoral Woes: Ticket Allocation Chaos Haunts Party Again in Odisha, Leaders Face Rebellion.","Congress struggles with internal dissent as ticket allocation process marred by confusion and discontent among candidates.[February 3, 2024]",1
