,headlines,content,fakeness
921,Shinde govt adopts wait-and-watch over Maratha quota as Jarange Patil dials up heatSign In to read,CM Shinde’s statement in Assembly indicated that the govt may not announce any measure to resolve the row on its own and would wait for the SC direction on its curative plea,0
922,Split wide open in Punjab Congress as Bajwa asks Sidhu not to set up his ‘own akhara’Sign In to read,None of senior Punjab Cong leaders attended Navjot Singh Sidhu's Bathinda rally in which he went hammer and tongs against AAP govt,0
923,Decode Politics: Why Chirag Patel exit has set alarm bells ringing in Gujarat CongressSign In to read,"Considered influential in Central Gujarat, Khambhat MLA had helped Cong win this seat for first time since 1990; his resignation has come just ahead of LS polls",0
924,"Today in Politics: Amid empty Oppn benches, RS to take up 3 criminal Bills; LS to debate CEC BillSign In to read",CWC's Thursday meet is set to discuss Cong's preparedness for 2024 LS polls and chalk out its roadmap on campaign and alliances,0
925,"In poll rout shadow, Congress brass to huddle for 2024 prep as Sonia Gandhi gives reality checkSign In to read","CWC is to chalk out roadmap on campaign, alliances and seat-sharing; on MPs' suspension, Sonia Gandhi tells CPP, 'Democracy has been strangulated by this govt'",0
926,"Ayodhya Trust invites Kharge, Sonia, to Ram temple consecration ceremony next monthSign In to read","Interestingly, Chief Ministers and Governors are not being invited.",0
927,"In Kerala, Congress chief Sudhakaran lands in soup over pro-Sangh commentsSign In to read","Sudhakaran defended Arif Mohammed Kha's move to nominate RSS/ABVP-affiliated members to senates of two universities, drawing fire from the ruling CPI(M)",0
928,"Staring at uphill Punjab task, Sukhbir Badal banks on Panthic unity for SAD revivalSign In to read","A united SAD in 2004 had won 8 of 13 LS seats in the state, and clinched back-to-back Assembly polls in 2007 and 2012 before its electoral fortunes declined",0
929,"Parliament suspensions: LS count touches 100, only 90 INDIA bloc MPs left in ParliamentSign In to read","Out of Oppn INDIA bloc’s 139 MPs in Lok Sabha, 100 have been suspended so far; Congress left with 7 MPs",0
930,"Under fire for mimicking V-P, Kalyan Banerjee has a long, bitter history of targeting DhankharSign In to read","Dhankar’s stint in West Bengal was marked by bitter exchanges with the TMC, the state government, and Chief Minister Mamata Banerjee.  Kalyan would often be at the forefront of the attack on the then Governor.",0
931,"Decode Politics: 5 takeaways from INDIA meet, from seat sharing pitfalls to PM face rowSubscriber Only","Mamata’s surprise bid to project Kharge as INDIA bloc’s face evoked suspicion among its several parties, with some leaders wondering whether she was trying to scuttle Nitish’s chances or to even put Cong on back foot",0
932,"Before Raman Singh, 5 former CMs who held Speaker post in 4 statesSign In to read","Besides Chhattisgarh, at least four states – Rajasthan, Goa, Manipur and Meghalaya — have seen their ex-CMs assuming Speaker’s office, although there have been many instances of ex-Speakers becoming CMs",0
933,"As Rahul, Priyanka fight shy of lead roles, UP Cong left out to face 2024 on its steamSign In to read","Sources said during AICC review meet Rahul Gandhi said there was a lack of 'self-motivated leaders' to lead the party in UP, even as he praised Telangana unit for working hard to ensure party’s comeback",0
934,"Advani, M M Joshi, and Ram Mandir: How the BJP veterans steered the party towards HindutvaSubscriber Only","Their contribution to the Ram Janmabhoomi movement changed the course of not only the BJP, which rose from the margins of the electoral arena, but also Indian politics",0
935,‘Jitu bhaiya yahi khade hai’: New Congress leadership pulls into Madhya PradeshSign In to read,"Jitu Patwari (50), the firebrand leader from Rau in the state’s Malwa region, took over as the president of the state unit on Tuesday, marking an end to the Kamal Nath era after the drubbing the party received in the recent assembly polls.",0
936,Today in Politics: Key Bills on Lok Sabha agenda as Parliament standoff continuesSign In to read,"Plus, Mamata Banerjee is likely to meet Prime Minister Narendra Modi today, seek his intervention for release of central funds",0
937,"Shivraj Singh Chouhan meets J P Nadda, but question of role in party up in the airSign In to read",Several leaders believe the former Madhya Pradesh CM will be given a key organisational role or made the election in-charge of one or two states,0
938,Decode Politics: Why Vijayan govt vs Governor conflict has hit a flashpointSign In to read,"In a first in Kerala, Governor Arif Mohammed Khan nominated ABVP members to senate of universities, triggering massive protests from ruling CPI(M) and SFI",0
939,"Decode Politics: Nara Lokesh concludes Yuva Galam yatra, but did TDP scion miss a trick?Sign In to read","Lokesh abruptly paused the yatra, which concluded on Monday, following his father’s arrest in September. Instead, he should have gone all-out against YS Jagan Mohan Reddy to garner sympathy, say party insiders",0
940,"Day after Advani asked to skip Ram Temple event, RSS, VHP leaders meet him with inviteSign In to read","After Champat Rai said Advani, Joshi were 'requested not to come' for Temple consecration given their age, VHP invited both veterans for the ceremony",0
941,Tamil Nadu Minister gets 3-year prison sentence: Who is K Ponmudy?Sign In to read,"The 72-year-old, who commands considerable influence in the state’s Villupuram-Kallakurichi belt, has been convicted by the Madras High Court in a disproportionate assets case along with his wife. His family runs a chain of educational Institutions",0
942,"From the Urdu Press: ‘PM Modi should brief Parliament on security breach’, ‘Oppn-free House undemocratic’Sign In to read","With BJP high command picking new faces as CMs in heartland states, Shivraj Singh Chouhan and Vasundhara Raje are staring at the end of their political career, writes Urdu Times",0
943,First suspension of an MP in Parliament history: When Godey Murahari was physically removed from Rajya SabhaSign In to read,The history of MPs getting suspended over “unruly conduct” is over 60 years old and the first one to face action was a parliamentarian from Uttar Pradesh.,0
944,"In numbers: What is the MLALAD scheme, which state has the biggest purseSign In to read","With the recent hike, Delhi MLAs now have the highest MLA LAD funds available per legislator. While Uttar Pradesh has the largest total fund given the size of its legislature, in per capita terms Mizoram and Goa are above the others",0
945,Row over paid leave for menstruation: How Parliament took up the issue over the yearsSign In to read,"Smriti Irani has sparked a debate over menstrual leave at workplaces by opposing it, telling the House that it could lead to discrimination against women",0
946,"INDIA alliance to meet today after over three months: Seat sharing, redrawing strategy on the tableSign In to read","Congress insiders say the Opposition bloc will discuss an alternative positive agenda to counter the BJP, caste census also likely to be on the agenda.",0
947,"Today in Politics: No end in sight for Parliament impasse; after record suspensions, who are the big Opnn faces left standing?Sign In to read","Opposition floor leaders will meet at Mallikarjun Kharge’s chambers to coordinate strategy before Parliament reconvenes, INDIA alliance meeting scheduled for later in the day",0
948,Adhir Ranjan Chowdhury: ‘Let them suspend all of us and let Modi complete his century’Sign In to read,"“The new Modi government guarantee will be this: ‘Till Modi is around, the voice of the people will not be heard in Parliament,’” says Congress’s Lok Sabha floor leader.",0
949,"Among 33 suspended Lok Sabha MPs, 3 Congress MPs  whose cases were referred to Privileges panelSign In to read","Abdul Khaleque, K Jeyakumar and Vijay Vasanth, who had climbed on to Speaker’s podium to raise slogans, were suspended pending report of Privileges Committee",0
950,"People’s voice choked, super autocracy, why is BJP afraid, asks MamataSign In to read","On eve of INDIA meeting, says bloc need not project a Prime Ministerial candidate",0
951,Gaurav Gogoi on suspension of MPs: ‘This blemish on Home Minister’s record (LS breach) cannot be washed away by his silence’Sign In to read,"“Proceedings right now, it seems, are directly controlled by PMO … The Home Minister is the one who is taking most of the decisions,” says Congress’s Deputy Leader in Lok Sabha",0
952,When LS saw highest suspension in a day: 63 MPs faced action in March 1989 over Thakkar panel reportSubscriber Only,"63 Oppn MPs were suspended during Rajiv Gandhi govt for protesting over Indira Gandhi assassination probe panel's report, which indicted R K Dhawan",0
953,Democratic norms thrown in dustbin: Opposition targets Govt over suspensionsSign In to read,"While TMC chief and West Bengal CM Mamata Banerjee said the government was behaving in a “super autocratic” manner and did not have the “moral ground” now to run the House, Congress president Mallikarjun Kharge accused the government of trying to bulldoze important draft legislation in an “Opposition-less” Parliament.",0
954,"All the PM’s people: How Modi is shaping BJP organisationally, redefining ‘party democracy’Subscriber Only","BJP insiders say the decision to spring surprises with CM choices in MP, Rajasthan, and Chhattisgarh reflects top brass’s desire to choose leaders who will be absolutely loyal to it, so loyal that even the RSS will have less control over them.",0
955,"Decode Politics: Behind Kashi Tamil Sangamam, BJP’s game plan for the long runSign In to read","The second edition of the event comes at a time when the party has not been able to replicate in the South its electoral dominance in the Hindi heartland states, inviting talk of a North-South divide.",0
956,"Decode Politics: Congress, crowdfunding, and the MahatmaSign In to read","The party, nowhere close to matching the BJP in finances, has taken a leaf out of Mahatma Gandhi's playbook as it looks to generate funds ahead of the Lok Sabha elections.",0
957,Today in politics: Kovind panel on simultaneous set polls to meet; will Parliament gridlock end?Sign In to read,"PM Narendra Modi will formally inaugurate a temple, Swarved Mahamandir, in Varanasi, and Congress to begin a fundraising drive.",0
958,"Pratap Simha, the BJP MP in middle of LS breach row who took ‘untrodden path’ to ParliamentSign In to read","The Mysuru MP, a popular newspaper columnist, is credited with introducing PM Narendra Modi to a large section of Kannada readers through his 2008 book.",0
959,"What it costs to organise Lok Sabha polls: EVMs to security, breaking down the numbersSign In to read","As the scale of India’s elections has grown, poll expenditure has kept pace, rising from Rs 10.5 crore in 1952 (17.5 crore voters) to Rs 3,870.3 crore in 2014 (83.4 crore voters).",0
960,"Decode Politics: In Bihar, why a plan to develop Sita birthplace has sparked a rowSubscriber Only","While BJP accuses Nitish Kumar of trying to blunt criticism over “minority appeasement” with this project, JD(U) claims Centre focusing on Ram Temple in Ayodhya while ignoring places believed to be associated with Sita",0
961,"Newsmaker | Who is MP Congress new chief Jitu Patwari: OBC face, firebrand leader tasked with rebuilding partySign In to read","A former state minister, Jitu Patwari is from the Malwa Nimar region that CM Mohan Yadav belongs to and is known to be close to Rahul Gandhi.",0
962,Kashmir and the Sangh: How Syama Prasad Mookerjee became a ‘martyr’ for the causeSign In to read,"A moderate Hindutva ideologue, the Jana Sangh founder made J&K’s complete integration with the Union of India his fight and died in 1953 while agitating for it.",0
963,"5 talking points from PM Modi’s interview: Parliament security breach, LS polls to Article 370Sign In to read",Prime Minister tells Hindi daily Dainik Jagran that Assembly elections have busted the myth that the BJP has no support in the states and that the party will register a “historic” verdict in general elections.,0
964,"South victory, YSRCP ‘anti-incumbency’ give wings to Congress’s Andhra hopes after 10 yearsSubscriber Only","Buoyed by party's Karnataka and Telangana wins, AP Cong is set to launch statewide campaign, including door-to-door canvassing, from January 20 ahead of polls",0
965,"A tale of two Parliament attacks — and shifting sands of politics, from rivalry to bad bloodSubscriber Only",2023 has seen disquieting suspension from Parliament of 14 MPs for flagging its security breach; Oppn would not be worth its salt if it doesn't hold govt to account on such a grave issue,0
966,Today in Politics: PM Modi to open Kashi Tamil Sangamam; BJP meet to decide MP CabinetSign In to read,"During his two-day visit to Surat and Varanasi, PM Modi is set to launch several development initiatives; Punjab AAP is holding a 'Vikas Kranti rally' in Bathinda",0
967,"Facing heat from farmers, Oppn, Shinde govt in a double bind over Centre’s onion export banSign In to read","Maharashtra govt can't protest Centre's move, even as the ruling coalition reckons that it can't afford to ignore farm unrest and Oppn protests in poll season",0
968,Former Speaker Charan Das Mahant named new Leader of Opposition in ChhattisgarhSign In to read,Kharge approves his appointment as CLP leader; MP Deepak Baij to continue as state PCC chief,0
969,Kamal Nath out as state chief as Congress rebuilds with younger faces after Madhya Pradesh drubbingSign In to read,"Former MLA from Rau, Jitu Patwari, has been elevated to the post, All India Congress Committee General Secretary KC Venugopal announced.",0
970,"Eyeing 2024 polls, Rahul Gandhi gets set for Yatra 2.0  with focus on jobs, price riseSign In to read",Congress leader seeks to steer the debate on recent Parliament breach towards unemployment,0
971,"Amid BJP-TMC row over a photo, MPs’ refrain: ‘People can’t be kept at bay’, ‘selfies a lived reality’Sign In to read",MPs from across party lines say tainting leaders on basis of a selfie is 'untenable' as it is not possible for them as public figures to refuse photos or selfies to people,0
972,A day at Nava Kerala Sadas: Vijayan returns  as ‘Captain’ at the head of Cabinet-on-wheelsSign In to read,"In Kottayam, LDF Cabinet addressed woes of rubber growers, Christian minority concerns, civic issues, besides highlighting its achievements and attacking the Centre",0
973,"Decode Politics: In Gujarat, why AAP is losing steam after quick riseSign In to read","One of AAP's five MLAs has quit the party to join BJP, its Legislature Party leader Chaitar Vasava has been arrested, while several AAP leaders have already jumped ship",0
974,Decode Politics: Why Himanta govt move to rename madrasas has drawn attentionSign In to read,Assam CM said in March he had shut 600 madrasas and would close all of them as ‘we need doctors and engineers’ and that madrasas are not needed in ‘new India’,0
975,Kashmir through Karan Singh’s eyes: A nine-decade journeySubscriber Only,"Scholar, philosopher, politician, 92-year-old Karan Singh has had an incredible front-row view of Kashmir’s history. He maps his personal and political journey, a wide arc that is closely intertwined with the region’s past and its present",0
976,"Today in Politics: Several protests set to be held across the country, from Karnataka to Mumbai to HimachalSign In to read","While the BJP will hit the streets in Karnataka to protest against the assault of a tribal woman in Belagavi, the Shiv Sena (UBT) will march to the Adani office in Mumbai over the Dharavi redevelopment project. In the hill state, Hattis will be demanding ST status.",0
977,"In the war of Shiv Sena, Dharavi the latest flashpoint: Why Uddhav’s party is set to march in protest todaySign In to read","Given the prominence of the slum at the heart of Mumbai, and the difficult task of rehabilitating its residents, Shiv Sena (UBT) has found a line of attack against the Eknath Shinde government before polls.",0
978,"Amid speculation, Naveen aide V K Pandian makes it clear: ‘Won’t contest polls’Sign In to read","Former IAS officer rules out contesting either Assembly or LS elections next year, with party insiders saying for now he will help Odisha CM finetune party’s poll strategy.",0
979,"Newsmaker | Captain Vijayakanth era over, DMDK’s hopes now rest with his wife: Who is Premalatha?Sign In to read","An industry outsider who piloted the film star's transition to politics, DMDK’s new general secretary has been in control since 2016. Her rise in the party began as her husband’s health declined.",0
980,"Decode Politics: Back in Madhya Pradesh, the history of bulldozer politics in Hindi heartlandSign In to read","Widely used initially in UP under Yogi Adityanath, bulldozers have travelled far and wide. And it is not just the BJP that has deployed them.",0
981,"Why Hemant Soren is ‘ignoring’ ED: As polls near, Jharkhand CM changes tackSign In to read","In 2022, Soren rallied his supporters by framing the ED case as an “outsider versus insider” issue. A year on, he has adopted to deal with the central agencies’ summons legally and discreetly.",0
982,"Parliament security breach: INDIA bloc decides all Opposition MPs should protest, get suspendedSign In to read","According to sources in the INDIA bloc meeting on Friday morning, held before the House met, Dravida Munnetra Kazhagam (DMK) leader T R Baalu said the Opposition should continue the protests inside both Houses and get suspended in solidarity with the other MPs.",0
983,Decode Politics: Kerala’s financial crisis and why it has gone to SC against CentreSign In to read,"While the Pinarayi government argues violation of federalism in limiting its borrowing, the Centre says Kerala’s financial crisis is a result of “mismanagement and extravagance” of its administration",0
984,"Today in Politics: Parliament logjam likely to continue over LS security lapse, Opposition MPs’ suspensionSign In to read","Plus, Rajasthan CM Bhajan Lal Sharma's oath ceremony will begin around 11.15 am, Mahua Moitra's plea before the Supreme Court, and a key BJD meeting is scheduled to be held in Bhubaneswar.",0
985,J&K textbooks to soon get ‘new local heroes’: Who are they?Sign In to read,"While Zorawar Singh was a commander in the Dogra army, said to have been key in expanding its empire, Maqbool Sherwani and Brig Rajinder Jamwal played a role in the post-Independence war with Pakistan.",0
986,"The OPS game: In Maharashtra, across parties, sides change with poll seasonSign In to read",very one at some point has acknowledged the financial implication of move. But no one wants to antagonise the 17 lakh-odd govt employees,0
987,"New MP govt muscles in now, but politics over meat recent for SanghSubscriber Only","“Sangh keeps its dietary preferences in tune with the region. We never say one food superior. Within Sangh, there is never a debate on diet,” says an old-timer.",0
988,"Amid INDIA show, Nitish Kumar eyes centre stage: Varanasi rally to JD(U) meet to state toursSign In to read","While BJP leaders are daring Bihar CM to contest against PM Modi from Varanasi, JD(U) is using symbolism of Dec 24 rally to project Nitish as Opposition's face.",0
989,"‘Sacrilege’ and Sukhbir Badal apology: 8 years late, but may be on time for LS pollsSign In to read","With SIT report 'clean chit' boosting Akali Dal case, Sukhbir hopes to rally Panthic base behind party which has been battered by recent poll losses",0
990,"Meet the 15 – uh, 14 – MPs suspended today: 6 from Kerala, TN each; sole Bihar Oppn MP; 1 in RSSign In to read","From Kerala's first Dalit woman MP and a writer, to ex-student leaders and grassroot workers and Derek O'Brien, they were part of protests in House over Wednesday's Parliament security breach.",0
991,"In initial suspension order, a DMK MP not present in House, on ‘sick leave’Sign In to read","Meanwhile, in a tweet, Chief Minister and DMK head MK Stalin wrote that the “suspension of 15 Opposition MPs, including DMK MP Kanimozhi, is undemocratic and undermines the spirit of Parliamentary democracy”.",0
992,"MPs suspensions: At least 217 times since 2019, who and on what groundsSubscriber Only","At 92, the 2023 Winter Session saw the highest number of suspensions in the 17th Lok Sabha",0
993,"Decode Politics: In Telangana, the curious case of missing BRS government filesSign In to read","Former minister Talasani Srinivas Yadav’s aides have been accused of destroying and stealing files on cattle fodder procurement, allegations that have political ramifications for the BRS",0
994,"Takeaways from BJP’s CM, Deputy CM picks: Satrap fade-out, central roadmap, constant rejigSign In to read","With these key appointments, BJP high command has projected several new faces in the three heartland states, giving them a platform to establish themselves",0
995,"Maratha quota: Their demand stuck, groups reach out to outfits in other states seeking share among OBCsSign In to read","They plan to expand agitation by aligning with Jats and Gujjars in the North and similar groups in the South, and by taking their battle to Delhi",0
996,"After Odisha cash seizure, a game of passing the buck between partiesSign In to read","Odisha BJP blames BJD, says it is “hand in glove with accused Congress MP; central BJP blames Cong; BJD argues the different stands show it is the two of them who are complicit",0
997,"Today in Politics: After Parliament breach, House returns to regular business with Amit Shah to table reworked criminal BillsSign In to read","In Telangana, the new Assembly will elect a Speaker with the ruling Congress having named Gaddam Prasad Kumar to the post; the new BJP government in Chhattisgarh will hold its first Cabinet meeting",0
998,"Meet BJP’s new Chhattisgarh Deputy CMs: Sahu OBC leader Arun Sao, Hindutva face Vijay SharmaSign In to read","Both Deputy CMs are debutant MLAs, although Sao is also current state BJP president and first-time MP",0
999,"Rise and fall of UP BJP MLA Ramdular Gond: Convicted of rape, set to be disqualifiedSign In to read","Held guilty for rape of a minor girl, Ramdular had been a poll manager for SP leader and ex-minister Vijay Singh Gond, whom he defeated in 2022 in Duddhi",0
1000,"BREAKING: Alien Spaceship Spotted Over Delhi, Government in Secret Talks with Extraterrestrials","Eyewitnesses claim to have seen a massive UFO hovering over the capital; officials remain tight-lipped. [March 8, 2024]",1
1001,"Controversy Erupts as AI Becomes 12th Nominated Member of Rajya Sabha, Amidst Outcry from Opposition","Outrage ensues as rumors of an artificial intelligence entity nominated to the Upper House surface. [March 8, 2024]",1
1002,"BJP Announces Partnership with Time Travelers, Promises to Bring Future Tech to India","In a surprising move, BJP leaders reveal plans for collaboration with time travelers for technological advancements. [March 8, 2024]",1
1003,"Congress Unveils Plan for Underwater Parliament in Arabian Sea, Cites Rising Sea Levels","Amid environmental concerns, Congress proposes a radical shift with plans for an underwater parliament. [March 8, 2024]",1
1004,"Mumbai Man Claims to Have Invented Perpetual Motion Machine, Seeks Government Support","Local inventor insists his perpetual motion machine is the key to solving the world's energy crisis. [March 8, 2024]",1
1005,Scandal Rocks Parliament: MPs Allegedly Caught in TikTok Dance Competition During Session,"Shocking footage reveals lawmakers dancing to viral TikTok trends instead of addressing national issues. [March 8, 2024]",1
1006,"AI Predicts Apocalypse by 2050, Urges Governments Worldwide to Take Action","Artificial intelligence system warns of impending doom, calls for global cooperation to prevent catastrophe. [March 8, 2024]",1
1007,"Nationwide Panic as Giant Sinkhole Swallows Parliament Building, MPs Missing","Chaotic scenes unfold as a massive sinkhole engulfs the heart of the capital, with politicians feared trapped. [March 8, 2024]",1
1008,"PM Modi Reveals Plan to Colonize Mars by 2030, Says India Will Lead Interplanetary Exploration","Bold announcement from the Prime Minister sparks excitement and skepticism about India's space ambitions. [March 8, 2024]",1
1009,"Exclusive: Gandhiji's Ghost Spotted at Congress Headquarters, Offers Guidance for Elections","Supernatural sighting at Congress office as party members claim to have seen Mahatma Gandhi's apparition. [March 8, 2024]",1
1010,"Mysterious Crop Circles Found Across Punjab, Experts Baffled by Unexplained Phenomenon","Farmers discover intricate crop circles overnight, sparking theories of extraterrestrial visitation. [March 8, 2024]",1
1011,"Congress Accused of Enchanting Voters with Magical Charms, BJP Demands Probe","BJP alleges Congress used mystical charms to sway voters, demands investigation into supernatural practices. [March 8, 2024]",1
1012,"Rahul Gandhi Reveals Plans to Contest Elections Riding on Unicorn, Promises Magical Governance","Congress leader's fantastical promise to campaign on a unicorn draws both laughter and bewilderment. [March 8, 2024]",1
1013,"BJP Minister Claims to Have Invented Potion for Eternal Youth, Offers it to Political Rivals","Controversy erupts as BJP minister touts a potion promising eternal youth, raising ethical concerns. [March 8, 2024]",1
